{
  "$schema": "https://json-schema.org/draft/2020-12/schema",
  "$id": "https://oss-vuln-lab.local/schemas/cve-corpus-manifest.schema.json",
  "title": "oss-vuln-lab CVE Corpus Manifest",
  "type": "object",
  "required": ["cve_id", "summary", "project", "language", "replay"],
  "properties": {
    "schema_version": {
      "type": "string"
    },
    "cve_id": {
      "type": "string",
      "minLength": 1
    },
    "summary": {
      "type": "string",
      "minLength": 1
    },
    "project": {
      "type": "string",
      "minLength": 1
    },
    "language": {
      "type": "string",
      "enum": ["c_cpp", "python", "javascript", "java", "rust", "binary", "unknown"]
    },
    "vuln_family": {
      "type": "string",
      "minLength": 1
    },
    "references": {
      "type": "array",
      "items": {
        "type": "string"
      },
      "default": []
    },
    "aliases": {
      "type": "array",
      "items": {
        "type": "string"
      },
      "default": []
    },
    "affected_versions": {
      "type": "array",
      "items": {
        "type": "string"
      },
      "default": []
    },
    "fixed_versions": {
      "type": "array",
      "items": {
        "type": "string"
      },
      "default": []
    },
    "metadata": {
      "type": "object",
      "default": {}
    },
    "replay": {
      "$ref": "#/$defs/replay"
    }
  },
  "additionalProperties": true,
  "$defs": {
    "artifact": {
      "type": "object",
      "required": ["name"],
      "properties": {
        "name": {
          "type": "string",
          "minLength": 1,
          "pattern": "^(?!\\.\\.?$)[^/\\\\]+$"
        },
        "content": {
          "type": "string"
        },
        "encoding": {
          "type": "string",
          "enum": ["text", "base64"],
          "default": "text"
        },
        "file_path": {
          "type": "string",
          "minLength": 1,
          "pattern": "^(?!/)(?!.*(?:^|/)\\.\\.(?:/|$)).+$"
        }
      },
      "anyOf": [
        {
          "required": ["content"]
        },
        {
          "required": ["file_path"]
        }
      ],
      "additionalProperties": true
    },
    "replay": {
      "type": "object",
      "required": ["title", "vuln_family", "repro_command"],
      "properties": {
        "title": {
          "type": "string",
          "minLength": 1
        },
        "vuln_family": {
          "type": "string",
          "minLength": 1
        },
        "repro_command": {
          "type": "string",
          "minLength": 1
        },
        "artifacts": {
          "type": "array",
          "items": {
            "$ref": "#/$defs/artifact"
          },
          "default": []
        },
        "severity": {
          "type": "string",
          "default": "high"
        },
        "candidate_file": {
          "type": "string",
          "default": ""
        },
        "candidate_line": {
          "type": ["integer", "null"],
          "minimum": 1
        },
        "function_or_sink": {
          "type": "string",
          "default": "known_poc"
        },
        "notes": {
          "type": "string",
          "default": ""
        },
        "configure_args": {
          "type": "array",
          "items": {
            "type": "string"
          },
          "default": []
        },
        "runtime_env": {
          "type": "object",
          "additionalProperties": {
            "type": "string"
          },
          "default": {}
        },
        "references": {
          "type": "array",
          "items": {
            "type": "string"
          },
          "default": []
        }
      },
      "additionalProperties": true
    }
  }
}
